שם,כתובת,יום,קטגוריה,הערה
KidZania,"KidZania, The Dubai Mall, Financial Center Rd, Dubai, UAE",יום 4,אטרקציה,עיר תפקידים - מתאים לכל 4 הבנות יחד.
אקווריום דובאי,"Dubai Aquarium & Underwater Zoo, The Dubai Mall, Dubai, UAE",יום 4,אטרקציה,"בתוך המול, ממוזג, לכל הגילאים."
The Green Planet,"The Green Planet, City Walk, Al Safa, Dubai, UAE",יום 4,אטרקציה,יער גשם ממוזג - מנצח לבת בת ה-4.
סקי דובאי,"Ski Dubai, Mall of the Emirates, Al Barsha, Dubai, UAE",יום 4,אטרקציה,שלג בתוך קניון - Snow Park מגיל 3.
בורג' ח'ליפה At The Top,"Burj Khalifa, 1 Sheikh Mohammed bin Rashid Blvd, Downtown Dubai, UAE",יום 4,ערב,תצפית בשקיעה. להזמין כרטיסים מראש.
